{
  "name": "Localized Languages (With Auto Cards)",
  "version": "1.0.0",
  "author": "LewdLeah",
  "authorProfileUrl": "https://play.aidungeon.com/profile/LewdLeah",
  "description": "Localized Languages (LoLa) is a context overhaul script for multilingual accessibility in AI Dungeon scenarios/adventures. Learn More: https://github.com/LewdLeah/Localized-Languages",
  "minInstallerVersion": "0.0.1"
}
